;text;truthRating
2187;Photographs show an 1890 gravestone with an anti-Democratic epitaph.;1
6833;Law firm issues Seussian response to a motion by opposing counsel for the court to ignore a lawyer’s Christmas vacation request.;1
3244;Red Bull and other brands of energy drinks contain bull semen.;0
9525;Canadian banknotes once included an image resembling a grinning devil behind Queen Elizabeth’s ear.;1
4252;After the shootings of Dallas policemen, 'nearly 500 people applied in just 12 days.';1
3952;Feminine hygiene products are subject to sales tax in most states.;1
1917;'Heroin .. pours across our southern borders.';1
1973;In July 2017, it was announced that Finnish researchers would begin human trials of a Type 1 diabetes vaccine in 2018.;1
8238;Snake inadvertently loosed in car leads to an escalating series of accidents.;0
6336;Contends that President Obama 'literally said (if) his cap-and-trade proposals were to pass, that utility rates, his words now, would, 'necessarily skyrocket.'';1
6489;Under a law known as the droit du seigneur (“right of the lord”),  medieval noblemen had the right to spend the first night with newly-wedded brides in their fiefdoms.;0
3770;Hugh Hefner paid $75,000 to be interred next to Marilyn Monroe in a Los Angeles cemetery.;1
9494;'Reporters rehearse questions with White House press (secretary).';0
7623;'Tim Kaine doesn’t want a border at all. He wants to get rid of Immigration and Customs Enforcement and basically the border patrol as well.';0
5864;Obama Volunteer Alerted Secret Service;1
2047;If Democrats gain a majority in the House of Representatives,  Maxine Waters could become chair of a committee that has the power to subpoena President Trump’s bank records.;1
9873;A video clip from the Notre Dame cathedral fire shows a man walking alone in a tower of the church 'dressed in Muslim garb.';0
4707;U.S. President Donald Trump 'crashed' a wedding a 'groped' the bride.;0
9199;“65% of [city] water goes to formal residential customers”;1
804;'President Obama became the first president since Carter to leave the White House with a smaller federal prison population than when he took office.';1
1809;'Although the governor doubled the beach fees . . . all the money, as we found out, is all going to an out-of-state company. The state isn't even getting the money for that.';0
9363;Jon Ossoff is running to represent Georgia's sixth congressional district while living outside its boundaries.;1
7399;'He has never voted for a federal restriction on gun ownership.';1
2100;An image shows Nancy Pelosi's mansion in San Francisco and the large wall that protects the estate.;0
8294;'Two-thirds of our economy is a consumer economy.';1
814;'Seattle police begin gun confiscations: no laws broken, no warrant, no charges.';0
2653;Living turtles and fish have been packaged in plastic bags and sold as souvenir keyrings in China.;1
1169;Senator Elizabeth Warren said that women being raped was an acceptable cost for the tolerance of Muslims and praised Planned Parenthood.;0
4668;Says Barack Obama 'said when he was running for office four years ago that he would halve the annual deficit by the end of his first term. That simply has not happened.';1
1443;A California artist is collecting brassieres  to use in constructing a giant Bra Ball.;1
4052;Monthly Medicare Part B premiums are set to jump to $247.00 in 2014.;0
3073;Obama's budget plan would 'take national debt up to about 80 percent of gross national product. ... Historically, it's been about 40 percent.';1
5510;Among Milwaukee Public Schools students, '86 percent are behind in reading and 80 percent are behind in math.';1
2546;Hillary Clinton filed for divorce from Bill Clinton in November 2016.;0
224;'We spend more per student than almost any other major country in the world.';1
660;The Iraq war has been 'our longest war.';0
522;'There is nothing in the current state public records law that prohibits sensitive or confidential business information from being just that, confidential.';1
2655;A baby giraffe that earned viral fame in April 2017 passed away a month after birth.;0
2279;Says Adam Schiff used taxpayer money to 'reach a sexual harassment settlement with a 19-year-old male.';0
3982;Quotes Adolf Hitler as saying the best way to control a people is 'to take a little of their freedom at a time.';0
7728;Singer Bobby Shmurda was stabbed to death at Rikers Island by his cellmate.;0
8345;Says President Barack Obama released a statement on the 'death of brother Robin Williams before ... a statement on brother Michael Brown.';1
3736;Will one in three women in South Africa be raped? Blow the Whistle wrong again | Africa Check;0
9085;Soccer star Mia Hamm died in January 2019.;0
1608;“Government is actively involved in the property sector, having provided more than 4 million houses since 1994.”;1
867;'The increase in the garbage tax that [Mayor Allan Fung] imposed in Cranston for some people has been as much as $200.';0
4025;An audit shows 'there are 6.5 million people who have active Social Security numbers who are 112 years of age or older,';1
8456;A man saw dead people and talked to God after he was deprived of his senses during a government experiment.;0
5917;Historically, more collect phone calls are made on Father’s Day than on any other day of the year.;1
8567;Over the past five years, the American automobile industry has 'created about 500,000 new jobs.';1
2850;Says actor Morgan Freeman said, 'Jailing Hillary' is the best way to 'restore public faith in government.';0
7654;The discount chain E.J. Korvette took its name from a shortening of ‘eight Jewish Korean War veterans’ in honor of its founding partners.;0
8729;'Application for March for Our Lives permit was made months before Parkland shooting';0
760;The 2007 film The Golden Compass is based on a series of books with anti-religious themes.;1
9233;Some residence locks are vulnerable to unauthorized entry through the use of “bump keys.”;1
8649;Says a picture he posted on Facebook of a man posing in front of five decapitated human heads is 'one of the subhuman mongrels our president set free.';0
3413;Says he’s the first Aggie governor of Texas.;1
6577;Milwaukee lost the headquarters for MillerCoors because the area lacks good transit.;0
4653;The Reuters news agency has proscribed the use of the word ‘terrorists’ to describe those who pulled off the September 11 terrorist attacks on America.;1
5995;A man lured by the promises of a barroom temptress submits to being tied naked to a bed, then receives a surprise backdoor visit from Batman.;0
6638;“From an allocation of KSh210 billion in the FY 2013/2014, we now stand at KSh327 billion for the FY 2017/2018, an increase of 56% in five years.”;0
4227;Sitting inside a running, snowed-in car can result in carbon monoxide poisoning.;1
3638;Says Newt Gingrich aligned with Nancy Pelosi on global warming.;1
103;Chase Bank deleted a tweet advising consumers to shore up low account balances by not eating out or buying coffee.;1
4231;The term “hoity-toity” comes  from the French words haut toit, meaning “high roof.”;0
9360;'More college graduates are living at home than in decades.';1
8907;A toddler was ejected from a roller coaster after his teen mother circumvented height regulations and sneaked him onto the ride.;0
7171;Judge Sonia Sotomayor said that “the time has come to end white male oppression by castrating every white male.”;0
1697;Photographs show Japanese women wearing imitation see-through skirts.;0
3863;Says 'Donald Trump was doing a rally in the state of Florida' the day Trump's son and others met with a Russian lawyer in New York.;0
7448;'The country's bankrupt.';0
9117;A video shows a group of Muslims ripping up an American flag on a New York City street.;1
9555;'I never once asked that (Megyn Kelly) be removed' as a debate moderator.;0
3588;Says that while his plan would narrow the time for early voting, 'it still will be one of the most aggressive early voting time frames in America.';0
6007;Says she was never a  member of the Georgia Log Cabin Republicans.;0
2665;Says Gloria Steinem once called Kay Bailey Hutchison a 'female impersonator.';1
1627;'The Amityville Horror' is based on a true story.;0
4896;An image shows President Trump getting a spray tan in the oval office.;0
3607;If you die, you can send your ashes to legislators as one final act of protest.;1
1110;CNN reported that Twitter is deleting Donald Trump's account over its use of 'racist rhetoric.';0
6731;'Three out of the 18 benchmarks of the (GAO) have been fulfilled. Even among Republican math, that is a failing grade.';1
831;Says Paul Manafort’s sentencing judge, Amy Berman Jackson, 'conceded that there was absolutely no evidence of any Russian collusion in this case. So that makes two courts. Two courts have ruled no evidence of any collusion with any Russians.';0
619;President Donald Trump offered to donate $1 million to a charity of Sen. Elizabeth Warren's choice if she would take a DNA test to demonstrate that she had Native American ancestry.;1
6930;Says Mitt Romney would deny gay people the right to adopt children.;0
4470;'The State Election Board has issued nearly $275,000 in fines to violators of absentee ballot laws.';1
5525;Earthlink is sending out suspension notices via e-mail and asking subscribers to verify their credit card information.;0
3287;Says Donald Trump called pregnant employees 'an inconvenience.';1
2141;'Gov. Crist has never wavered in his support of the Second Amendment, the right to bear arms.';1
511;'Before this day is out, 18 more veterans will have taken their own lives.  That is the daily average, it is intolerable, and it has to stop.';1
8705;Cameron Lyle gave up his collegiate athletic career to donate bone marrow to a young man with leukemia.;1
8438;Two claims on drug use in Nigeria;1
3940;'Now, I also support the Bush tax cuts. Sen. McCain voted against them originally. He now believes they should be made permanent. I'm glad he agrees they should be made permanent.';1
8242;As of May 2018, there were more than 10,000 unaccompanied children in United States government immigration detention centers.;1
4281;'I've cast a couple of 99-1 votes' and been the lone dissenter.;1
6362;Precipitation in smoky areas following a wildfire is likely to be extremely toxic.;0
4780;“Tourism earnings grew 20% in 2017.”;1
6933;Golfer who sticks his scrotum into a ball washer is horribly injured.;0
6567;Photographs show a sandstorm in Iraq.;1
8371;Cleveland Browns running back Isaiah Crowell once posted to his Instagram profile an artist's rendering of a hooded man cutting the throat of a police officer.;1
2221;Photograph shows Arizona billboard poking fun at Los Angeles’ decision to boycott that state over illegal immigrant legislation.;0
1118;The Obama administration approved the transfer of funding to the Islamic Relief Agency, a Sudan-based organization with ties to Al-Qaeda.;1
7873;Photographs show a puppy with a heart-shaped pattern in its coat.;1
2051;Facebook has instituted a campaign banning marijuana-related posts and threatened to terminate the accounts of repeat offenders.;0
9719;'Women and men both are making less when you adjust for inflation than when' John Kitzhaber was first elected governor.;0
8628;"President Obama absent from the Arlington 2010 Memorial Day
Ceremony";1
1138;In his first TV interview as president, Obama said we 'should talk to Iran.';1
242;Italian wedding soup gained its name from being traditionally served at weddings.;0
2489;Austin was the 'site of the first mass shooting in the country.';0
713;President Trump ordered the execution of several turkeys pardoned by President Obama.;0
8281;The Macomb County Police Department held a press conference about a potential 'vigilante' serial killer after three pedophiles were murdered in one week.;0
6374;A page on Hillary Clinton's campaign web site about campus sexual assault was edited to remove wording about a victim's 'right to be believed.';1
3103;Says Mitt Romney flip-flopped on abortion.;1
3622;Baskin-Robbins outlets will be offering free ice cream to pregnant women on 21 May 2008.;1
877;The '2 Millions Bikers to DC' group has been denied a 'no-stop' permit for a Washington ride-through on 11 September 2013.;1
5636;A private club (the only place in the park where alcohol is served) is housed in Disneyland's New Orleans Square.;1
4941;'Austin is the largest city in the U.S. or Texas with no geographic representation' on its city council.;1
4202;Thirty-eight states -- Georgia not included -- have appointed, rather than elected, state school superintendents.;1
7662;'Over 40 percent of children born in America are born out of wedlock.';1
7605;Under certain conditions, lionesses can grow manes and develop 'masculine behavior'.;1
9982;'NASA will pay you $100,000 to stay in bed for 60 days!';0
4483;'When the Dallas/Fort Worth Airport needed to stop its earthquake spike a few years ago, they temporarily shut down the wells that were injecting fracking fluid into the ground ... (and) those earthquakes stopped.';1
3308;Says that under President Obama, there’s been a substantial increase in federal government jobs.;0
2567;Says Dick Cheney 'supported gay marriage sooner' than Hillary Clinton.;1
6701;Michigan motorists can be fined for not signing the backs of their car registrations.;0
7954;Catherine McKenna: Andrew Scheer has “no climate plan.” - FactsCanada;1
1768;'The national economy was strong in its largest expansion of private sector jobs before President Trump came into office.';1
6545;President Obama has spent over $2 million in legal fees defending lawsuits about his birth certificate.;0
25;Television evangelists Jerry Falwell and Pat Robertson said that liberal civil liberties groups, feminists, pagans, homosexuals, and abortion rights supporters bear partial responsibility for the terrorist attacks on the USA because their actions have turned God’s anger against America.;1
9324;A photograph shows a jumping baby elephant.;0
1390;The UK issued a travel advisory for LGBT citizens visiting the United States after Mississippi and North Carolina passed controversial laws.;1
3405;Radio host Dr. Laura Schlessinger stated during a broadcast that pit bulls in an animal shelter were  “taking up space” and that they should all be “put down.”;1
639;U.S. Rep. lhan Omar wants to legalize the sale of dog meat in the U.S.;0
8464;In 2009, Democratic Wisconsin state senators 'rammed through a billion-dollar tax hike in 24 hours with no public input.';1
7085;A Florida man has “married” a 6-month-old boy.;0
7574;'A witness will testify against Hillary Clinton.';0
6124;Harambe received 15,000 votes in the presidential election.;0
1521;The Wendy’s fast food restaurant chain uses rat and horse meat to make their chili.;0
5666;'Forty-seven percent of (members of Congress) are millionaires.';1
5768;'We already have $23 billion worth of debt.';1
4043;'There are no federal or state laws that say prosecutors must seek death sentences. And the United States Supreme Court has banned all state laws that make executions mandatory for murders.';1
240;The United States is deporting military veterans.;1
5339;Says none of the government programs targeted for elimination or severe cutback in House Republican spending plans 'appeared on the GAO's list of government programs at high risk of waste, fraud and abuse.';1
6522;The Baby Ink body art chain specializes in tattooing babies and children.;0
4529;Actress Betty White has died.;0
2613;'We're now the No. 1 producer of oil in the world. We've surpassed Saudi Arabia.';1
9941;Caitlyn Jenner said that 'I look more feminine than Serena Williams.';0
8163;Of minimum wage workers in Rhode Island 'only 14 percent serve as sole income earner for their family.';1
9726;Map shows an optimal route for driving across the USA and hitting major landmarks in every state.;1
8426;Vyacheslav Ivanov, a former executive at Rosatom, was killed in a February 2018 plane crash as part of a 'deep state' plot to cover up corruption by the Clintons.;0
4056;ABC fired Joy Behar from her job co-hosting 'The View' after she made comments about Vice President Mike Pence's religious beliefs.;0
9354;You can help donate food to abused, neglected, and abandoned animals by clicking a button on a web site.;1
3169;Rob Cornilles has been endorsed by 20 local mayors, including Independent, Democratic and Republican.;0
7952;'Every (Wisconsin) legislator that votes for this bill' will have to 'give up the same amount of pay' as other state employees.;1
8493;A loophole 'still exists which allows members of Congress and high-powered executive branch appointees to exploit 'insider' knowledge of the financial industry in order to turn personal profit.';1
988;Tells President Barack Obama that he also asked former President George W. Bush about how he felt about Americans hating him.;1
7943;'This town (Wilmington, Ohio) hasn’t taken any money from the government. They don’t want any money from the government.';0
9331;“We have created 3.7-million work opportunities [between April 2009 and March 2014].”;1
4216;A photograph shows CNN reporter Anderson Cooper seductively posing in his underwear.;0
363;An image showing Marilyn Monroe with a cat is a genuine photograph.;0
5296;The Israelis 'gave up 1,000 terrorists in return for one sergeant.';1
7648;Sarah Palin 'has more experience than Barack Obama.';0
2552;'99.4% of businesses in Wisconsin are small businesses,' and they employ 'nearly half of our workforce.';1
4568;A U.S. War Department film from the 1940s warns Americans that political rhetoric condemning minorities and foreigners is a precursor to fascist movements like Nazism.;1
3202;'McCain got more money from Airbus' U.S. executives than any other politician.';1
6514;Buyer who answers unbelievable ad in paper offering a vintage Corvette for a pittance discovers the car belonged to the seller’s son, who was killed in Vietnam, and is being offered for so low a price because the bereaved mother has no inkling of the vehicle’s true value.;0
6857;'Florida ranks last in the ratio of employees to residents... And Florida is dead last in the nation in state employee payroll expenditures per resident.';1
8278;Thieves are stealing women’s thighs and replacing them with oatmeal.;0
5740;Monica Wehby and Jason Conger are 'causing devastating consequences' for nearly 23,000 Oregonians looking for work.;0
5237;Yes, health data shows that South Africans drink the most in Africa | Africa Check;1
2056;Melania Trump 'liked' a tweet that poked fun at her relationship with her husband, President Donald Trump.;1
1664;The national debt saw a 'surprising' decline of $102 billion between 20 January and 27 July 2017.;1
6267;'Fidel (Castro) has made his preferences known in the campaign and had some very unkind things to say about me.';1
1494;Iraqi militant web site displays image of action figure toy identified as a captured American soldier.;1
7644;”To date, 385 public entities have been registered in the portal, and 5,236 contracts published valued at Ksh 146.5 billion.”;1
5566;Says Terry McAuliffe 'opposes' Virginia’s right-to-work law.;0
3602;President Obama stopped wearing his wedding ring and wristwatch in observance of the Islamic holy month of Ramadan.;0
7780;Says 'PTA meetings are now being conducted to help parents tell their kids' that if a guy with an AR-15 walks into their classroom, 'you are supposed to create as much chaos as you possibly can. They want you to scream and yell and dance around and throw books and just keep moving.';1
1981;President Obama filed federal charges against Darren Wilson moments after a grand jury’s decision not to indict him was announced.;0
359;A video shows a sea cucumber that resembles a headless chicken.;1
1310;A new U.S. Citizenship and Immigration Services task force is charged with identifying naturalized citizens who cheated on their applications and seeking the revocation of their citizenship, a process known as 'denaturalization.';1
1793;'Since 2000, when he entered politics, Jon Husted has been on the ballot six times for three different political offices.';1
4491;Donald Trump was never accused of racism before he ran for president in 2016.;0
7207;Says John F. Kennedy Jr. said, 'If my dear friend Donald Trump ever decided to sacrifice his fabulous billionaire lifestyle to become president he would be an unstoppable force for ultimate justice that Democrats and Republicans alike would celebrate.';0
1724;The 'forestry department' urges you to lay buckets of water out for wildlife that may cross your yard while escaping a wildfire.;0
